1,"{""link"": {""en"": null, ""ru"": null}, ""title"": {""en"": ""<p>Introduction</p>"", ""ru"": ""<p>Введение</p>""}, ""bold_text"": {""en"": null, ""ru"": null}, ""link_text"": {""en"": null, ""ru"": null}, ""sub_title"": {""en"": null, ""ru"": null}, ""italic_text"": {""en"": null, ""ru"": null}, ""image_text_1"": {""en"": null, ""ru"": null}, ""image_text_2"": {""en"": null, ""ru"": null}, ""regular_text"": {""en"": ""<p>&nbsp; &nbsp; The birth of a human being on this Earth is a true miracle, bestowed by nature and located far beyond our understanding. At the time of his birth the first cry of a human being informs the whole world that he had come to this Earth and our land is ready for his appearance. Everything he needs is prepared for him: the air &ndash; to breathe, the breast milk and warmth &ndash; to eat and grow, the incredible beauty and variety of nature - to be developed and enjoyed, a crystal clear water &ndash; to drink. At the time of his birth, nature did not prepare his race, public or religious affiliation, social or political status, nature did not specify that he would be a slave or rule the world, all this and much more, mindfully, people made up for him. Nature so energized this little miracle with its positive energy, that being exhausted after birth, on having cuddled him, his mother feels so powerful rush of love and kindness, in the light of which, all the pain she&#39;s suffered, becomes just the flour dust.</p>\r\n\r\n<p>&nbsp; &nbsp; Nature freely awarded a newborn with his own uniqueness, which lies not only in the fingerprints, appearance, retina or DNA structure - it gave him a completely unique gift to think, feel, see and feel the world, thereby, complementing another drop that produces perfect balance. It suggested that the birth of this child creates a clear balance between the amount of resources on our planet and the number of people. The ecosystem of the land awarded a baby with 7 billionth part of its resources, which includes not only water and air, but also the iron ore, gold, oil and natural gas, granite, diamonds, forests, fields and deserts. Although, in contrast to the natural, the human system immediately withdrew from him all these gifts and gave them to the state, being somehow sure that nature has made a big mistake and the baby will not be able to dispose these gifts properly and that the use of these gifts will lead to the inevitable catastrophe. And as soon as the happy parents registered their child in the public authorities, thus, they declared him a citizen of his country. State care, compensating retrieved nature gifts, bestowed this little happy being, who has not yet had time to take the first step on this land, with the proportional part of its foreign debt. After all, today every country in the world has an external debt, for which every citizen of this country bears the responsibility. It is easy to calculate by dividing the amount of external debt on the citizens of this country. Every newborn American today has a debt in the amount of $ 62 398, Ukrainian - $ 4 609, Saud - $ 708, Japanese - $ 98 025 etc.&nbsp;</p>"", ""ru"": ""<p>&nbsp; &nbsp; Рождение человека на этой Земле &mdash; это истинное чудо, дарованное природой и находящееся далеко за пределами нашего понимания. В момент своего рождения своим первым криком человек оповещает весь мир о том, что он прибыл на эту Землю и наша Земля готова к его появлению.</p>\r\n\r\n<p>&nbsp; &nbsp; Она приготовила для него всё необходимое: воздух &ndash; для того, чтобы он дышал, материнское молоко и тепло &ndash; чтобы он питался и рос, невероятную красоту и разнообразие природы &ndash; для того, чтобы он развивался и наслаждался, кристально чистую воду &ndash; для того, чтобы он пил.</p>\r\n\r\n<p>&nbsp; &nbsp; В момент его рождения природа не готовила ему расовую, государственную или религиозную принадлежность, социальный или политический статус, природа не определяла: быть ему рабом или властвовать над миром - всё это и многое другое предусмотрительно придумали для него люди.</p>\r\n\r\n<p>&nbsp; &nbsp; Природа настолько зарядила это маленькое чудо своей положительной энергией, что измученная родами мать, прижав его к себе, чувствует настолько мощный прилив добра и любви, в свете которого всё перенесённые ею муки становятся просто пылью.</p>\r\n\r\n<p>&nbsp; &nbsp; Природа бесплатно наградила новорождённого присущей только ему неповторимостью, заключающейся не только в отпечатках пальцев, внешности, сетчатке глаза или составе ДНК - она одарила его совершенно неповторимым даром мыслить, чувствовать, видеть и ощущать окружающий мир, дополнив тем самым еще одну каплю для создаваемого ею идеального баланса.Она посчитала, что рождение этого ребёнка создает четкий баланс между количеством ресурсов на нашей планете и количеством людей.</p>\r\n\r\n<p>&nbsp; &nbsp; Экосистема земли наградила младенца 7-миллиардной частью своих ресурсов, в которую входит не только вода и воздух, но и, как ни странно, железная руда, золото, нефть и газ, гранит и алмазы, леса, поля и пустыни.</p>\r\n\r\n<p>&nbsp; &nbsp; Но в отличие от природной, человеческая система тут же отобрала у него все эти дары и передала их государству, будучи почему-то уверенной, что природа сделала большую ошибку и ребёнок не сможет распорядиться этими дарами правильно, и что использование этих даров ребёнком приведёт к неизбежной катастрофе.</p>\r\n\r\n<p>&nbsp; &nbsp; И как только счастливые родители зарегистрировали своё дитя в органах государственной власти - тем самым они объявили его гражданином своей страны.</p>\r\n\r\n<p>&nbsp; &nbsp; Государство, заботливо компенсируя забранные природой дары, одарило этого маленького счастливого человечка, ещё не успевшего сделать первый шаг по этой земле, пропорциональной частью своего внешнего долга. Ведь сегодня каждая страна в этом мире имеет внешний долг, за который в ответе каждый гражданин этой страны. Это легко посчитать, разделив внешний долг на количество граждан этой страны. Каждый новорождённый американец сегодня должен примерно $ 62 398, украинец - $ 4 609, саудит - $ 708, японец - $ 98 025 т.д.&nbsp;</p>""}}",1,10,1,,,1
2,"{""link"": {""en"": null, ""ru"": null}, ""title"": {""en"": null, ""ru"": null}, ""bold_text"": {""en"": null, ""ru"": null}, ""link_text"": {""en"": null, ""ru"": null}, ""sub_title"": {""en"": null, ""ru"": null}, ""italic_text"": {""en"": null, ""ru"": null}, ""image_text_1"": {""en"": null, ""ru"": null}, ""image_text_2"": {""en"": null, ""ru"": null}, ""regular_text"": {""en"": ""<p>&nbsp; &nbsp; Nature constantly shows people its genius and balance for all of us. After all, history did not register any fact of birth of a person with supernatural powers in all directions, the person, who would be able to combine the eyes of Aristotle &ndash; who did not need a flight into space to see that the Earth is round, have the fingers of Ludwig van Beethoven, who created the lunar sonata, being completely deaf, the voice of Luciano Pavarotti, the brain of Leonardo Da Vinci, the ability to providence of Vanga, the mime of Charles Chaplin.</p>\r\n\r\n<p>&nbsp; &nbsp; In order to imagine the natural system, I took its creation - a unique self-regulating human body. The body and all the organs of a human being are composed of cells. In humans, there are no same cells, as in human society, there is no same person. I imagined the human body is composed not of the cell, but every organism living on the Earth. Every day in the human body a huge number of cells dies and being born, this process can be associated with the birth and death of all living beings on our planet. At the birth of new cells, it is already prepared place and breeding ground for them, they are not nourished by the neighboring cells, and for it has all the conditions for life and development. Each cell is born with its mission and the quality of its development influences on the quality of the whole organism.</p>\r\n\r\n<p>&nbsp; &nbsp; But in spite of these obvious facts, the humanity continues to live on the principle of divide and rule, using a centralized management system. <strong><em>This centralized system gives superpower to a very small group of people, deciding who will live and who will not, who will live in fear and suffer from the fact that he has something to lose, and who by the fact that has nothing to eat.&nbsp;</em></strong></p>"", ""ru"": ""<p>&nbsp; &nbsp; Природа постоянно показывает людям свою гениальность и сбалансированность всех нас. Ведь историей не зарегистрировано ни одного факта рождения человека со сверхъестественными способностями во всех направлениях, человека, который смог бы объединить в себе глаза Аристотеля, которому не нужен был полёт в космос, чтобы определить, что Земля круглая; человек с пальцами Людвига Вана Бетховена, создавшими лунную сонату, будучи совершенно глухим; голосом Лучано Паваротти, мозгом Леонардо Да Винчи, возможностью провиденья Ванги, мимикой Чарльза Чаплина.</p>\r\n\r\n<p>&nbsp; &nbsp; Для того чтобы представить себе природную систему, я взял её творение - уникальный саморегулирующийся организм человека. Тело и все органы человека состоят из клеток. В организме человека нет ни одной одинаковой клетки, как и в людском обществе нет ни одного одинакового человека. Я представил себе человеческое тело, состоящее не из клеток, а из каждого живого организма, живущего на Земле. В человеческом организме ежедневно отмирает и рождается огромное количество клеток - этот процесс можно сопоставить с рождением и смертью всего живого на нашей планете. При рождении новой клетки для неё уже подготовлено место и питательная среда, она не питается за счет соседних клеток, для неё созданы все условия для жизни и развития. Каждая клетка рождается со своей миссией и от качества её развития зависит качество развития всего организма.</p>\r\n\r\n<p>&nbsp; &nbsp; Но, несмотря на все эти очевидные факты, человечество продолжает жить по принципу &laquo;разделяй и властвуй&raquo;, используя при этом централизованные системы управления.</p>""}}",1,,0,,,2
3,"{""link"": {""en"": null, ""ru"": null}, ""title"": {""en"": null, ""ru"": null}, ""bold_text"": {""en"": null, ""ru"": null}, ""link_text"": {""en"": null, ""ru"": null}, ""sub_title"": {""en"": null, ""ru"": null}, ""italic_text"": {""en"": null, ""ru"": null}, ""image_text_1"": {""en"": null, ""ru"": null}, ""image_text_2"": {""en"": null, ""ru"": null}, ""regular_text"": {""en"": ""<p>&nbsp; &nbsp; Fundamentals of the above-described perfectly revealed in the movie &ldquo;Zeitgeist&rdquo; by Peter Joseph, &ldquo;Thrive&rdquo; by Foster and Kimberly Carter Gamble, books and performances of David Icke, in the movie &ldquo;The 11th Hour&rdquo; by Leila Conners Petersen with Leonardo DiCaprio, but in spite of the completeness and the genius of these creations, they are fully complemented by the movies &ldquo;HOME&rdquo; and &ldquo;Planet-ocean&rdquo; by the world-renowned wildlife photographer Yann Arthus-Bertrand, which shows that we are doing with our planet, the documentary &ldquo;Earthlings&rdquo; by Shaun Monson, demonstrating our truly brutal treatment of animals, living on our planet, and supplementing his movie with &ldquo;Cowspiracy: the Sustainability Secret&rdquo; by Kip Andersen, which talks about the impact of industrial livestock production on the ecology of the planet, a feature movie &ldquo;On the beach&rdquo; by the Australian director Russell Mulcahy that opened the eyes of millions of people on the real danger of nuclear war, the movie &ldquo;The Light Bulb Conspiracy &rdquo; by Cosima Dannoritzer about planned obsolescence.</p>\r\n\r\n<p>&nbsp; &nbsp; Each of us can extend the list of problems and possible solutions shown in these movies, which once again confirm that every inhabitant of our human community sees, understands and perceives the world differently, and only if we collect together the knowledge and understanding of all people to create and not to destruct, we can achieve the harmony, which is inherent in us by nature.&nbsp;</p>"", ""ru"": ""<p><strong><em>&nbsp; &nbsp; В централизованной системе очень маленькой группе людей отведена роль сверхчеловека, решающих кому жить, а кому - нет, кто будет жить в страхе и мучиться от того, что ему есть что терять, а кто - от того, что ему нечего есть.&nbsp;</em></strong></p>\r\n\r\n<p>&nbsp; &nbsp; Основы вышеописанного великолепно раскрыты в фильмах: &laquo;Дух времени&raquo; Питера Джозефа, &laquo;Процветание&raquo; Фостера и Кимберли Картер Гембл, &laquo;Одиннадцатый час&raquo; Лейла Коннерс Петерсен и Леонардо Ди Каприо, в книгах и выступлениях Дэвида Айка. Но, несмотря на полноту и гениальность этих творений, они полноценно дополняются фильмами: &laquo;HOME&raquo; и &laquo;Планета-океан&raquo; всемирно известного фотографа дикой природы Яна Артюса-Бертрана и режиссёра Люка Бессона, которые демонстрируют, что мы делаем со своей планетой; документальным фильмом &laquo;Земляне&raquo; Шона Монсона, демонстрирующим наше поистине зверское отношение к животным, живущим на нашей планете, и дополняющим его фильмом Кип Андерсена &laquo;Cowspiracy: The Sustainability Secret&raquo; (&laquo;Скотозаговор&raquo;), рассказывающим о влиянии промышленного животноводства на экологию планеты; художественным фильмом &laquo;On the beach&raquo; австралийского режиссера Малкей Рассела, открывшим глаза миллионов людей на реальную опасность ядерной войны; фильмом Косима Даннорицера &laquo;Эффект Лампочки&raquo; о запланированном устаревании.</p>\r\n\r\n<p>&nbsp; &nbsp; Каждый из нас может дополнить список проблем и возможных решений, показанных в этих фильмах, что ещё раз подтверждает, что каждый житель нашего человеческого сообщества видит, понимает и ощущает мир по-разному. И только если собрать воедино знания и понимание всех людей, направить их на созидание, а не на деструктивные процессы - можно добиться той гармонии, которая заложена в нас самой природой.</p>""}}",2,9,1,,,1
